#:F0 (down)
[root@ganp157]# /sbin/ethtool -m p4p1
	Identifier          : 0x03 (SFP)
	Extended identifier : 0x04 (GBIC/SFP defined by 2-wire interface ID)
	Connector           : 0x07 (LC)
	Transceiver codes   : 0x00 0x00 0x000x01 0x00 0x00 0x00 0x00
	                    :  => Ethernet: 1000BASE-SX
	Encoding            : 0x01 (8B/10B)
	BR, Nominal         : 1300MBd
	Rate identifier     : 0x00 (unspecified)
	Length (SMF,km)     : 0km
	Length (SMF)        : 0m
	Length (50um)       : 550m
	Length (62.5um)     : 270m
	Length (Copper)     : 0m
	Length (OM3)        : 0m
	Laser wavelength    : 850nm
	Vendor name         : CISCO-FINISAR   
	Vendor OUI          : 00:90:65
	Vendor PN           : FTLF8519P2BCL-CS
	Vendor rev          : B   

#:F2 (up)
[root@ganp157]# /sbin/ethtool -m p4p2
	Identifier          : 0x03 (SFP)
	Extended identifier : 0x04 (GBIC/SFP defined by 2-wire interface ID)
	Connector           : 0x21 (Copper pigtail)
	Transceiver codes   : 0x00 0x00 0x000x00 0x00 0x04 0x00 0x00
	                    :  => FC: Copper Passive
	Encoding            : 0x00 (unspecified)
	BR, Nominal         : 10300MBd
	Rate identifier     : 0x00 (unspecified)
	Length (SMF,km)     : 0km
	Length (SMF)        : 0m
	Length (50um)       : 0m
	Length (62.5um)     : 0m
	Length (Copper)     : 3m
	Length (OM3)        : 0m
	Passive Cu cmplnce. : 0x01 (SFF-8431 appendix E) [SFF-8472 rev10.4 only]
	Vendor name         : CISCO-PROLABS   
	Vendor OUI          : 00:00:00
	Vendor PN           : SFP-H10GB-CU3M  
	Vendor rev          : 07
